COMMENT_ID,USER_ID,MOVIE_ID,CONTENT,COMMENT_TIME,RATING,label
844463806,15307e312328534e6805dbe89256867b,10531425,狐狸哥明明就长得很奇怪，但就是会越看越帅越看越赞口水哗啦啦！粗粝的声线草鸡性感！吸烟的动作草鸡性感！拜托一定至少要是个BI哦！PS. 牛津多变态，入学需谨慎……,2014-09-10 09:12:39,5.0,Test
1780554764,15c47612ab726c442aed8e8e38d75c05,1400673,新精武门的续集，武打动作一样的出色，无厘头风格很好笑，张敏颜值真的很高,2019-05-09 13:39:20,4.0,Train
1793112449,15c47612ab726c442aed8e8e38d75c05,30240344,五个截然不同的女人有着截然不同的烦恼，五个小故事表现了现代女性的生活，不错,2019-05-20 18:17:28,4.0,Train
1802923294,15c47612ab726c442aed8e8e38d75c05,24827612,一般，就是第一步翻版，老套故事。唯一可圈可点的是宣传了预防火灾的重要性，培养防火意识真的很重要，比地震，泥石流什么都重要，因为最常见。,2019-05-30 17:30:05,3.0,Train
1807623905,15c47612ab726c442aed8e8e38d75c05,6070226,蜗牛和卷饼男都是不循规蹈矩的人，两者相遇相互支持，创造奇迹。,2019-06-02 20:26:04,4.0,Train
1807626749,15c47612ab726c442aed8e8e38d75c05,5154496,一般般吧，火鸡为了使自己不要变成感恩节食物而穿越改变历史的故事。男主瘦火鸡的转变为主要的，其中不工作就会变成傻子简直了,2019-06-02 22:46:38,3.0,Train
1810420427,15c47612ab726c442aed8e8e38d75c05,25928048,感觉还是永远的剧情模板，意外出现问题，然后为了解决问题经历一系列，然后happy ending，可能老了，不像小孩看的开心。,2019-06-04 16:44:06,2.0,Train
1810434754,15c47612ab726c442aed8e8e38d75c05,1929441,还不错挺搞笑的，人形飞船还挺有创意，就是寻找球体的过程有点简单和随意,2019-06-06 10:40:09,3.0,Train
1855561438,15c47612ab726c442aed8e8e38d75c05,25794302,又是一眼看结尾的剧情，经历了这么多女主还相信别人，简直蠢的一逼。感觉就是套娃移动迷宫,2019-07-11 12:42:59,2.0,Train
1862156327,15c47612ab726c442aed8e8e38d75c05,1305695,剧情挺一般的，但演员都是实力派，打斗很精彩但是太少，当年有点圈钱的嫌疑,2019-07-16 11:18:54,3.0,Train
1868596445,15c47612ab726c442aed8e8e38d75c05,1424218,感觉还不错，没有那么多的大场面，最多是掉了几颗炸弹和空袭了那一下。以男主视角讲述故事，表现了战争的残酷，烧焦的尸体，燃烧的油田，死了那么多普通人，还有伊拉克士兵。还有陆战队的日常，有训练，有无聊，有狂欢，有犯错被罚，也有女友出轨等。也有士兵回归生活后的空虚和不适应。也能看出科技对战争的改变，地上的士兵对战争的作用已经不大了，高科技才是致胜因素。,2019-07-21 02:25:51,4.0,Train
1893948789,15c47612ab726c442aed8e8e38d75c05,26791451,感觉还行，故事还算说的过去，不过通过这样的方式占领地球的目的是什么，复制了DNA不还是人吗？而且还复制了记忆，就是白痴人占领地球了。。。不过也算是悄无声息了，男女主裸了为什么还要打码，艺术就不要打码。,2019-08-06 18:37:08,3.0,Train
1901577659,15c47612ab726c442aed8e8e38d75c05,2062677,感觉还行，一个不错的故事片，故事讲的比较完整。最后还讽刺了英格兰国王的背信弃义。,2019-08-11 07:21:49,4.0,Train
1819828581,15c47612ab726c442aed8e8e38d75c05,26657440,懦弱只会被无止境的欺负，逃避没有用，女主两次被伤害后都没有学到这点。韩国电影果然会diss政府啊，大韩民国的法律。。。中国又何尝不是呢，未成年人，14岁以下，杀人都没事。,2019-08-17 10:05:56,3.0,Train
1866168346,15c47612ab726c442aed8e8e38d75c05,27200988,典型的成长故事，孤立的小女孩在某人（机器人）的帮助下经历一些事回归家庭。整体还行，漏洞问题很多，不管是机器人和人类干架还是科技公司肆意妄为，无政府监管等，都让剧情有些架空。还有那个机器人的自爆设定也太蠢了，何不直接一炮捶死人类。低配版大白,2019-09-02 11:03:56,3.0,Test
753461073,15e6d66faf3a15c3a6d1e2217a8b1718,1298377,充斥着70~80年代金属乐味道的电影。。情节什么的真是卧槽尼玛。。下面的影评简直中肯 一个字的话 脏 太脏了,2013-12-13 08:16:15,3.0,Train
904100127,15e6d66faf3a15c3a6d1e2217a8b1718,1962615,真心厉害，剧情各种天马行空，片里无数充满隐喻的镜头看完怎么琢磨都十分有趣，各种人物性格神态拿捏的也很棒，作为成人向的动画h的内容也恰到好处不会让人觉得有丝毫的色情。真是棒呆了的动画，比现在那些伪逼格的纯商业片强太多了,2015-03-18 05:37:41,5.0,Train
908963679,15e6d66faf3a15c3a6d1e2217a8b1718,25792649,看的窝简直失去了言语，作为一个观众羞耻到连晚饭都吃不下去了，那些演员到底是抱着多么大的决心接的片子。。太了不起了,2015-04-03 06:04:51,1.0,Train
1129248718,15e6d66faf3a15c3a6d1e2217a8b1718,7061330,总体来说剧本挺好的，但是节奏真的很拖沓。。。还算是有意思的电影，不是avgn粉就算了。。,2016-12-31 00:56:38,3.0,Train
1161698402,15e6d66faf3a15c3a6d1e2217a8b1718,1293508,多线叙事超棒！制作和特效也都很棒..作为娱乐片看得超过瘾，十三个主角每一个演技都超好超级拼的..超棒超满足><,2017-03-09 03:36:04,5.0,Test
1812384111,166180a125e9eefa7c2fc5d336c9536b,1905781,"三星半吧，两个失意的人的萍水相逢，更像是摩根弗里曼在讲自己，他说“我30岁才演第一部戏”就是他自己真实的写照

十件最讨厌的东西和十件最喜欢的东西，其实我也觉得好难

那首歌很有趣：
Oh please sit down
How do you do
This job is for me
The rest is poo

最近如果有面试，之前我就唱这首歌",2019-06-06 15:00:02,4.0,Train
1815026656,166180a125e9eefa7c2fc5d336c9536b,1460907,我记得以前特别喜欢这个电影，看的时国语版啊，居然是港片……感觉可以加入#一句话证明你是广东人#,2019-06-08 16:52:58,5.0,Train
1835025133,166180a125e9eefa7c2fc5d336c9536b,1437909,"想着再看一部达科塔·范宁的片子，发现大学时看过了，我就说嘛，梦工厂出品，又是励志片，怎么可能会错过

It's a world of business. Everything is for sale. Get a price tag for ourselves then?

""Take your money and get out of my barn.""",2019-06-25 17:22:18,5.0,Train
1879984276,166180a125e9eefa7c2fc5d336c9536b,4301285,"原来好几年前看过了，惊喜是洋葱骑士出演，不过这次记住了一个槽点：

什么时候知道自己screw up呢，就是别人说""You've done a fine job, but we'll take it from here.""

""People don't care about the truth anymore. Too messy, keeps you up all night.""",2019-07-28 21:00:40,4.0,Train
1882584629,166180a125e9eefa7c2fc5d336c9536b,3170961,"又发现我之前看过……以前怎么那么得空……

""You want my country weak and corrupt so that you can buy cheap trash from market.""

""It's a free market, not a free world.""",2019-07-30 13:28:59,4.0,Test
1832119933,16dad03b6173780f75c71a64931c36d6,20276230,"看了一个98min带西语硬字的奇怪版本，所以我到底错过了什么……
充满暧昧的暴力真是妙不可言:)",2019-06-23 16:39:59,4.0,Train
1855313546,16dad03b6173780f75c71a64931c36d6,3785918,"颇多意外之处啊
另，为什么我觉得妻女其实是一美幻想的存在？？
",2019-07-11 08:04:53,4.0,Train
1864280436,16dad03b6173780f75c71a64931c36d6,2277841,"Make me think of Bodyguard : it's the people who taste ""the taste of the consequence"".",2019-07-17 23:09:13,3.0,Train
1865896553,16dad03b6173780f75c71a64931c36d6,3236350,第一次生啃英字看长片，歌剧那段真是非常影响理解了……😂剧作上乘，喜欢病人陈述及男主妻子与之商量修葺的段落。表演令人动容。,2019-07-19 08:14:42,4.0,Train
1878469600,16dad03b6173780f75c71a64931c36d6,1452560,喝醉的马吉德坐进手推车里的那一幕太好了，没注意时间的我甚至以为要在那里结尾。音乐好听，尤其喜欢几次人物走过街头时的配乐。,2019-07-27 23:20:27,5.0,Train
1881785284,16dad03b6173780f75c71a64931c36d6,26653676,诚意之作。细节非常出彩：铅笔，风铃，卡带。Food bank那一段差点哭出来。,2019-07-29 22:27:00,3.0,Train
1888625904,16dad03b6173780f75c71a64931c36d6,1294547,Love and compassion for all men .,2019-08-03 10:50:05,4.0,Train
1899024106,16dad03b6173780f75c71a64931c36d6,26746558,后半段主角心理变化的层次没拍出来，有点垮了。Pierre Deladonchamps 太！美！了！,2019-08-09 23:05:36,3.0,Train
1903256964,16dad03b6173780f75c71a64931c36d6,1298609,"3.5。镜像/对称。无尽的欲望与纠缠。其实一度以为服毒而死也是少年的幻想……
想知道少年两次朗诵的德语诗是啥，字幕没翻译，有点可惜啊。片中几首德语歌曲都好好听啊，尤其是片尾曲Träume！！",2019-08-11 22:51:40,3.0,Test
1214045079,176e2dc75939def33f20af0734f499e2,26296026,不同的是不再一味把颜值放在首位，这才是真正的接地气儿的感情状况，虽然说是很多大帅比走上不归路，但更多平凡人，也应该有选择的权利。,2017-07-11 23:14:29,3.0,Train
1222799720,176e2dc75939def33f20af0734f499e2,22232939,大小就追的一部动画片，将近二十岁还是看得津津乐道，排成电影也很好看,2017-07-31 18:49:26,3.0,Train
1223932320,176e2dc75939def33f20af0734f499e2,25823277,"首先画面真的不能太美，用心制作的东西一定会脱颖而出
杨洋的演技在这部电影里边爆发了，连一撇一笑，举手投足间，感情都拿捏得十分得当。最喜欢桃林那场吻戏，夜华亦进亦退，骨子里爱情的渴望与他与生俱来的贵族气质相碰撞，他都表现了出来。就想说放开夜华让我来！！！
",2017-08-03 09:34:01,4.0,Train
1303250142,176e2dc75939def33f20af0734f499e2,26956641,所有演员谈不上技巧，讲的也是情怀，如果一定要说，那老乔的演技最让我佩服，虽然半集领盒饭，精湛到位的演技让我到剧终还记得,2018-01-09 22:21:45,3.0,Test
1164625479,178198897e563ccd7945cd4834cfddb8,1302325,这种复仇毁灭的题材很带感啊，冷漠的杀手，温情的父子，不错的一部电影。,2017-03-14 13:42:44,4.0,Train
1164932286,178198897e563ccd7945cd4834cfddb8,3073218,平淡而又真实的故事，年少时想着要打扮得漂漂亮亮，中年为生活而奔波，老年开始回忆和感慨，但生活就是这样，一直继续下去。,2017-03-15 08:58:34,4.0,Train
1164933808,178198897e563ccd7945cd4834cfddb8,1303010,总会有热情的人儿怀揣理想想去开拓着什么，路上会有阻碍，也会遇到志同道合或认可你的人，虽然现实不如想法完美，会磕磕绊绊，但收获的东西弥足珍贵。对女性的认可虽然说最终是要来自社会的普遍认可，但从女性自身来说，首先你需要认可你自己。,2017-03-15 09:05:02,4.0,Train
1165307823,178198897e563ccd7945cd4834cfddb8,1966050,剧情不错，不知道什么时候要面对恐怖袭击，每时每刻都是提心吊胆，紧张感把握好了，主题救赎也不错的体现了。,2017-03-16 08:26:57,4.0,Train
1169632577,178198897e563ccd7945cd4834cfddb8,26680247,生命是什么，生命有多长，只剩最后一段时光你想做些什么呢？很不错的电影，看了想了很多,2017-03-26 14:07:40,4.0,Train
1177776834,178198897e563ccd7945cd4834cfddb8,1294300,对白镜头都很有感觉，导演很会讲故事，讲喜欢的故事，不错的电影,2017-04-14 12:35:45,4.0,Train
1183360800,178198897e563ccd7945cd4834cfddb8,1298468,诗人与诗，文艺的一生，赋予电影更深层次，更美的意义，好美的影片,2017-04-28 09:41:14,4.0,Test
418986470,17d07b2df58faffe943cf3a92fd1d5d8,5403930,除去卖肉都很好·eruza是好女人！·gajiru好可爱！ed有种说不出的京东风 ,2011-07-30 13:05:27,5.0,Train
352561880,17d07b2df58faffe943cf3a92fd1d5d8,4910200,"不是说票房不错么
不是前两位都么看么
不是还有一位在造谣么
不是日饭看都回去画一织的图么
....
凭什么你们么看就说这不好！
凭什么还给低分
....
这次不是98亲自上阵么
我相信这部是死伤最好的剧场版！！！",2012-07-26 16:14:53,2.0,Train
727460984,17d07b2df58faffe943cf3a92fd1d5d8,24743030,居然出OAD了 池山的作品为什么在11区那么受欢迎= =简直部部狗血  藤村歩差评,2013-09-19 10:36:19,1.0,Train
733002703,17d07b2df58faffe943cf3a92fd1d5d8,25662100,看吐了要....本来准备看漫画的 出了剧看看= =好了现在漫画也不用看了,2013-10-06 21:31:31,3.0,Train
759503101,17d07b2df58faffe943cf3a92fd1d5d8,25784266,"快说DISNEY和DUFFY给了你们多少钱！
其实CP们都还不错  78好萌 但佐佐木演技实在是太拙计了= =脑洞演技太可怕",2013-12-30 14:59:31,4.0,Test
631914122,17e1b3478b5e7cbfe8d5958c4a0d937d,1295361,洋装很美，洛可可式的奢靡。Colin Firth！Valmont！只是有点遗憾这个片子，米高梅在80年代之后是不是就没有了好编剧？,2013-01-24 21:21:29,5.0,Train
640410977,17e1b3478b5e7cbfe8d5958c4a0d937d,1292893,暴丑的女主，当年《心灵捕手》连Matt Damon都配不上，居然还有男人喜欢，还你妹几个男人喜欢。我是为了Colin看的，可惜他只出现几个镜头，伤心！不过看到了半裸，弥补一下！,2013-02-07 15:34:05,3.0,Train
1210518812,17e1b3478b5e7cbfe8d5958c4a0d937d,26662798,看的媒体场。其实这种片我们只想看女鬼，对藤条和虫子不感兴趣，真的。,2017-07-03 15:27:37,2.0,Train
1285651560,17e1b3478b5e7cbfe8d5958c4a0d937d,26266892,和中国完全不一样的价值取向啊，学会甘于平凡，与不完美的自己和解。,2017-12-13 19:01:02,4.0,Train
1311665681,17e1b3478b5e7cbfe8d5958c4a0d937d,3914513,影片的主线冲突实在太荒谬，很难想象一个上流社会的女人嫁给一个男人，过着连芭蕾舞鞋都买不起的贫困生活，还觉得自己“太幸福了！老公不要出去打工！请陪伴我！贫穷赛高！”可能我始终是个下流社会的人吧……不懂你们高贵的上流社会。,2018-01-31 10:09:42,2.0,Train
1358946794,17e1b3478b5e7cbfe8d5958c4a0d937d,2123586,这个家族倒台的根本原因应该归咎于一夫一妻制，你想，如果他家纳妾那就多子多福，根本不存在没有继承人的问题；也不会夫妻不和，因为女人都忙着取悦丈夫呢。祖国伟大！,2018-04-18 18:04:50,3.0,Train
1360742217,17e1b3478b5e7cbfe8d5958c4a0d937d,5327381,《无耻混蛋》里的影院法国美女和被爆蛋的德国盖世太保在一起啦！～,2018-04-19 18:23:13,4.0,Train
1367425283,17e1b3478b5e7cbfe8d5958c4a0d937d,1308787,毛姆这个基佬可爱死了！朱莉娅姐姐幸福又可怜，四个男神围着她转，只有儿子和基友真心爱她，什么爱情，不存在的 T T ~,2018-05-02 17:33:23,4.0,Train
539995683,17e1b3478b5e7cbfe8d5958c4a0d937d,1296374,还入围过威尼斯金狮也是见鬼了，为了铁叔才看的，影片无论从大陆视角还是香港视角还是英国视角来看，都蛮无力的。,2018-05-22 23:18:20,3.0,Train
1423338562,17e1b3478b5e7cbfe8d5958c4a0d937d,27050259,脸脸还是这么帅这么基，还被捆绑了ԅ(¯﹃¯ԅ)，当电影说岁月没有在他脸上留下痕迹时，影院里响起了掌声。٩(๑^o^๑)۶,2018-08-01 13:38:58,4.0,Train
1490939614,17e1b3478b5e7cbfe8d5958c4a0d937d,1308360,唉，梦境照进现实该有多好，不停失忆回忆，想起的都是波澜壮阔，忘记的都是无聊平庸？JI就是好看啊，开船那段最好看😊，La Mer一响浪漫成真～,2018-10-11 00:51:19,3.0,Train
1509960175,17e1b3478b5e7cbfe8d5958c4a0d937d,1301518,其实让David Bowie演这个血后可能更有说服力一点，嗯～,2018-11-13 21:53:52,4.0,Train
465472547,17e1b3478b5e7cbfe8d5958c4a0d937d,1424632,被那个年代女性勇于参与历史、勇于做命运主人的激情所打动，那一波女权主义不应该随着革命时代的退潮而消亡。反观今天，女性的生存境况可以说是时代的倒退、革命的不彻底。片中霓虹灯照耀的礼义廉耻也只是没了耻字，今天呢？,2018-12-23 14:57:58,5.0,Train
1588337170,17e1b3478b5e7cbfe8d5958c4a0d937d,1304151,小说本身的场景是极其无聊的，它用场景的单一来揭露痛苦绝望的中产生活。看小说我就在想这么少的场景拍出来得多难看，果然影片添加了几个场景，显得丰富，用演员的痛苦和、空旷的海滨以及灰暗的颜色来表现空虚的精神世界，很棒！,2019-01-02 14:43:58,4.0,Train
1705928284,17e1b3478b5e7cbfe8d5958c4a0d937d,1293190,老片对于原著就是尊重啊！场景音乐都不错，尤其几个外景，浓雾之中有冷酷深寒之感。但是最后枪杀那一幕拍得实在差强人意，蒙太奇与表演甚至不如小说有悲剧感。史迈利如果是阿立克吉尼斯那该有多好。,2019-03-06 17:24:50,4.0,Train
1871342937,17e1b3478b5e7cbfe8d5958c4a0d937d,1294580,夏目漱石原作，现在应该庆幸是80年代拍的，那些年的导演拍大正风情，多少还能找到一点古典的意味，《春琴抄》如是，《细雪》也如是，哪怕就是表现西风东渐的时代，也能葆有东方的伤感与隐忍。如今的日本似中国，再也找不到半点古韵，古典也只能作为主流之外的亚文化保存，不胜唏嘘。,2019-08-01 14:03:09,5.0,Test
1051349831,180076880c32b2b360a1c812e85a1538,1309026,怎么说呢……这电影令我很反胃……猥琐也能猥琐的如此理所应当....我也真是无语了，狗男贱女的低俗性爱及其“爱情”，说爱情都有点亵渎了爱情二字！,2016-06-12 22:54:16,3.0,Train
1053667843,180076880c32b2b360a1c812e85a1538,1472563,我竟然看过这个电影.....为何没有任何印象...心中的野兽，对父亲，是对儿女的禽兽行为；对母亲，是对于孩子求助时的无视；对哥哥，是在得知妹妹被凌辱后杀死父亲；对盲女，是对女性身体的欲望；对丈夫，是背叛，是毫无底线的生理欲望,2016-06-20 11:26:49,5.0,Train
1203640574,180076880c32b2b360a1c812e85a1538,26999185,这片演员的颜值真高，很轻松的一个电影，讲了一个放荡男身边的故事，可是，我可以说我最喜欢里面的斑点狗吗？,2017-06-17 12:11:55,4.0,Train
1379616102,180076880c32b2b360a1c812e85a1538,27063031,真是个美丽又美好的老婆，也许真爱就是在出现状况时才能显现出它的光彩吧,2018-05-26 14:24:14,4.0,Train
1398004397,180076880c32b2b360a1c812e85a1538,27017288,为了烟，威士忌和男友活着的诗意女紫...她有颗自由，有尊严而且大彻大悟的灵魂，却与这个社会如此的格格不入……这就是世人皆醉我独醒的悲哀了吧……究竟谁是才是真正的穷人？她还是他们？,2018-07-01 18:00:24,5.0,Train
1563120537,180076880c32b2b360a1c812e85a1538,27186363,丧女之痛，妻离子散，丧爱之痛，削发出家后，在一个长满了蛆虫发黑的尸体前，他获得了救赎。披荆斩棘找回爱情的这段导演真是用心良苦。好电影。,2018-12-11 01:14:47,4.0,Train
1685476664,180076880c32b2b360a1c812e85a1538,30141372,这部片子满足了对爱情的各种幻想...它不是快餐式的欲望的满足，而是关乎理解，关乎认同...它也未必是观点一致的，但会尝试理解与接受对方的观点...,2019-02-20 17:47:14,4.0,Train
1762384534,180076880c32b2b360a1c812e85a1538,1423021,只觉得他命好苦...好惨...那被误杀的小女孩好可怜...但最可怜的还是他...得到的尽是世间恶意...又怎能释放出善呢…,2019-04-30 16:01:49,5.0,Train
1780751300,180076880c32b2b360a1c812e85a1538,27110448,剧情很简单单薄……但还算好看....其实蜜蜂能听懂人话，你信吗,2019-05-09 17:47:34,4.0,Train
1775476726,180076880c32b2b360a1c812e85a1538,1292521,码头的吃瓜群众里面的出头鸟，为了爱情、为了替自己死的哥哥、为了女友的哥哥、为了埋藏在内心深处的正义火焰，反抗黑帮统治的故事…发声者被杀、看客们尽管害怕却没人敢站出来维护正义，因为谁都怕丢掉饭碗、无法赚钱...,2019-05-10 17:36:56,4.0,Train
1781872407,180076880c32b2b360a1c812e85a1538,1294100,三个退伍军人的故事，退伍后的生计与工作问题、心理定位、婚姻关系，爱情....等等,2019-05-10 20:03:07,5.0,Train
1782610619,180076880c32b2b360a1c812e85a1538,26729194,一个著名编剧的人生最后阶段，想寻求儿子的原谅然后自杀...可是却被打了催眠针，意外发现自己没死后，他反而欣喜，在妻子的帮助下，终于化解了与儿子的矛盾，跟儿子女友道了歉，挣扎着撑到了见到孙子面孔的那一刻才死去...,2019-05-11 13:47:56,4.0,Train
1783785282,180076880c32b2b360a1c812e85a1538,26353381,...白发老人矿难中食人肉独活的心魔，被傻女孩也就是他的亲生孙女治愈，白发老人也实现了自己对女孩养父的诺言，这电影...故事全围绕着对金子的贪婪导致的杀心而起....有着浓郁的悲情色彩，毕竟看了两小时的主演们全死了，就活了小女孩一个...,2019-05-12 13:15:45,4.0,Test
1505908581,18b784aae8ee889c164ae089fd7d386f,1915096,一般般的感受。体能差异，强弱明显。寻仇的弱爆了，不选择原谅又能怎样？,2018-10-28 04:26:53,3.0,Train
1505912427,18b784aae8ee889c164ae089fd7d386f,4901320,"意图塑造一个冷血无情却又素爱思考人生哲理的、似海盗似哲学家似魔鬼野兽的、甲板上行走的荷尔蒙。结果，出来一个四不像。想展现人性的矛盾纠结，思想的冲突对撞，表现手法却是显得那般生硬和逻辑欠奉。能不能深邃点，能不能鲜明点，能不能彻底点？！越往后越看不下去了。比较而言，上部优于下部。
“这并不高贵，你的观点粗劣到极点了，和动物在一个水平，你可能是个变形虫。”关于强者生存的这段争论中的这句话，让我印象深刻。",2018-10-28 05:03:44,3.0,Train
1789615944,18b784aae8ee889c164ae089fd7d386f,1483878,太小了，当时被父母抱着去厂区电影院，看是绝对看不懂的，名字也不知道。但是那首回荡在影院的忧伤旋律，以及张瑜那双含泪的大眼睛，深深刻进我那幼小的心灵。就觉得好忧伤啊，好忧伤.....,2019-05-17 22:40:29,4.0,Train
1789793523,18b784aae8ee889c164ae089fd7d386f,1401130,看了这部片，我才终于明白，伍宇娟为啥是个美人。充满青春与野兽的气息。一只健康美丽的母兽。可惜了的女演员，生不逢时。湖南耒阳出此尤物，百年一遇。,2019-05-18 00:55:43,4.0,Train
1798068689,18b784aae8ee889c164ae089fd7d386f,1307546,三星都是凯特的。故事平平，全靠凯特撑起整部电影。我很想震撼和感动，无奈这类题材看得太多，背负社会与国家使命的正义女主，不屈不挠与犯罪分子对抗，不是伤痕累累就是搭上一条命，最终，正义战胜邪恶......非无感，而是触动不强烈了。影片乐曲很赞。空灵、悠远，有爱尔兰风情，也有苏格兰音乐的质感。,2019-05-25 02:31:51,3.0,Train
1891535061,18b784aae8ee889c164ae089fd7d386f,4074009,"纯情得那么不真实。许多人拥有相似的开头，至于结局，不过是天涯各方罢了。
如影片所述，每个人经过一番兜兜转转，最终都如愿以偿，和自己的初恋重续良缘。而这样的结局，需要一个恰好死掉未婚夫（妻），另一个好死不死赶上被配偶抛弃。最后，再遇重逢，还得相看两不厌。巧合因素太多，概率何其低。
唯美意淫片。",2019-08-05 00:14:10,4.0,Train
1913465307,18b784aae8ee889c164ae089fd7d386f,5295610,感人啊，有些受不鸟。感觉有些女人，除了孩子，真的是什么都可以不需要。,2019-08-18 00:13:24,4.0,Test
453020447,18cc665c5c4a39052e37adcaa2b1e683,1305986,二者都值得同情. Nothing is ever easy.,2011-11-02 20:59:56,4.0,Train
465771604,18cc665c5c4a39052e37adcaa2b1e683,3073202,"剧情前半部分太松散了, 幸好有Naomi Watts和Sean Penn的演技hold住了。整体还不错，政治方面略多。",2011-12-05 19:38:08,4.0,Train
488689854,18cc665c5c4a39052e37adcaa2b1e683,7162149,"视觉盛宴 Kylie, the most authentic diva of all. Suck that up, Madonna.",2012-01-29 20:30:42,4.0,Train
489792260,18cc665c5c4a39052e37adcaa2b1e683,1293077,"令我无比震叹和敬畏的电影。“This was not judgment day. Only morning.’
‘Morning: excellent and fair.”
",2012-01-31 23:57:33,5.0,Train
491266189,18cc665c5c4a39052e37adcaa2b1e683,5367075,她放不开。最好不要演喜剧，还是Lost in Translation这类的比较适合她。,2012-02-04 11:30:44,3.0,Train
432903581,18cc665c5c4a39052e37adcaa2b1e683,2238297,残忍的现实未必不好，就如疼痛即指病处；我们需揪其而愈之。社会的步伐在前进，而正如多位名人所说：多年过后，回望当今，我们深感当时的羞耻和落后。,2012-04-24 12:58:24,5.0,Train
535604194,18cc665c5c4a39052e37adcaa2b1e683,3349190,各种养眼各种福利有木有! 虽然有许多不足和赘余，但光看着美男(尤其是Paul&Charles)和舞剧就足以给五分了。,2012-05-24 02:03:46,5.0,Train
566166787,18cc665c5c4a39052e37adcaa2b1e683,1465415,虫虫各种萌! slimey gore + comic relief,2012-08-13 01:18:32,3.0,Test
